{
  "inputs": [
    {
      "uri": "data/module-map-v2/source-modules-and-resources.json",
      "rootScope": {
        "defaultContentType": "application/vnd.cem.module-map+json",
        "schema": "https://cem.dev/ns/data/module-map/2"
      }
    }
  ],
  "outputs": [],
  "schemaPackages": [],
  "resolvers": [],
  "scheduler": {}
}
