{
  "inputs": [
    {
      "uri": "data/cem-transform/basic-transform.cemt",
      "rootScope": {
        "defaultContentType": "application/vnd.cem.transform+cem",
        "schema": "https://cem.dev/ns/transform/cem/1"
      }
    }
  ],
  "outputs": [],
  "schemaPackages": [],
  "resolvers": [],
  "scheduler": {}
}
