{
  "inputs": [
    {
      "uri": "data/cem-native-template/basic-template.cem",
      "rootScope": {
        "defaultContentType": "application/vnd.cem.template+cem",
        "schema": "https://cem.dev/ns/template/cem-native/1"
      }
    }
  ],
  "outputs": [],
  "schemaPackages": [],
  "resolvers": [],
  "scheduler": {}
}
