{
  "inputs": [
    {
      "uri": "data/css-selector/basic-selector.css-selector",
      "rootScope": {
        "defaultContentType": "application/vnd.cem.query-expression+css-selector",
        "schema": "https://cem.dev/ns/query/css-selector/1"
      }
    }
  ],
  "outputs": [],
  "schemaPackages": [],
  "resolvers": [],
  "scheduler": {}
}
