{
  "inputs": [
    {
      "uri": "data/module-map/source-modules.json",
      "rootScope": {
        "defaultContentType": "application/vnd.cem.module-map+json",
        "schema": "https://cem.dev/ns/data/module-map/1"
      }
    }
  ],
  "outputs": [],
  "schemaPackages": [],
  "resolvers": [],
  "scheduler": {}
}
